{
  "$schema": "http://json-schema.org/draft-07/schema#",
  "title": "PlannerOutput",
  "type": "object",
  "additionalProperties": false,
  "required": ["intent", "slots", "steps", "sources", "confidence"],
  "properties": {
    "intent": {
      "type": "string"
    },
    "slots": {
      "type": "object",
      "additionalProperties": true
    },
    "steps": {
      "type": "array",
      "minItems": 1,
      "items": {
        "type": "object",
        "additionalProperties": false,
        "required": ["step_label", "api_call", "args", "expected_state"],
        "properties": {
          "step_label": {
            "type": "string"
          },
          "api_call": {
            "type": "string"
          },
          "args": {
            "type": "object",
            "additionalProperties": true
          },
          "expected_state": {
            "type": "object",
            "additionalProperties": true
          }
        }
      }
    },
    "sources": {
      "type": "array",
      "items": {
        "type": "string"
      }
    },
    "confidence": {
      "type": "number",
      "minimum": 0,
      "maximum": 1
    }
  }
}
